{
  "people_number": 1,
  "start_city": "北京",
  "target_city": "南京",
  "itinerary": [
      {
          "day": 1,
          "activities": [
              {
                  "start_time": "07:16",
                  "end_time": "08:23",
                  "start": "北京首都国际机场",
                  "end": "南京禄口国际机场",
                  "price": 448.38,
                  "cost": 448.38,
                  "FlightID": "FL159",
                  "type": "airplane",
                  "tickets": 1,
                  "transports": []
              },
              {
                  "position": "明孝陵",
                  "type": "attraction",
                  "transports": [
                      {
                          "start": "南京禄口国际机场",
                          "end": "禄口机场-地铁站",
                          "mode": "walk",
                          "start_time": "08:23",
                          "end_time": "08:26",
                          "price": 0,
                          "cost": 0,
                          "distance": 0.27
                      },
                      {
                          "start": "禄口机场-地铁站",
                          "end": "苜蓿园-地铁站",
                          "mode": "metro",
                          "start_time": "08:26",
                          "end_time": "09:35",
                          "price": 7,
                          "cost": 7,
                          "distance": 34.56,
                          "tickets": 1
                      },
                      {
                          "start": "苜蓿园-地铁站",
                          "end": "明孝陵",
                          "mode": "walk",
                          "start_time": "09:35",
                          "end_time": "09:52",
                          "price": 0,
                          "cost": 0,
                          "distance": 1.48
                      }
                  ],
                  "price": 65.0,
                  "cost": 65.0,
                  "tickets": 1,
                  "start_time": "10:00",
                  "end_time": "11:20"
              },
              {
                  "position": "鲤院(夫子庙店)",
                  "type": "lunch",
                  "transports": [
                      {
                          "start": "明孝陵",
                          "end": "苜蓿园-地铁站",
                          "mode": "walk",
                          "start_time": "11:20",
                          "end_time": "11:37",
                          "price": 0,
                          "cost": 0,
                          "distance": 1.48
                      },
                      {
                          "start": "苜蓿园-地铁站",
                          "end": "三山街-地铁站",
                          "mode": "metro",
                          "start_time": "11:37",
                          "end_time": "11:47",
                          "price": 3,
                          "cost": 3,
                          "distance": 5.42,
                          "tickets": 1
                      },
                      {
                          "start": "三山街-地铁站",
                          "end": "鲤院(夫子庙店)",
                          "mode": "walk",
                          "start_time": "11:47",
                          "end_time": "11:50",
                          "price": 0,
                          "cost": 0,
                          "distance": 0.33
                      }
                  ],
                  "price": 499,
                  "cost": 499,
                  "start_time": "12:00",
                  "end_time": "12:50"
              },
              {
                  "position": "狮子山景区",
                  "type": "attraction",
                  "transports": [
                      {
                          "start": "鲤院(夫子庙店)",
                          "end": "三山街-地铁站",
                          "mode": "walk",
                          "start_time": "12:50",
                          "end_time": "12:53",
                          "price": 0,
                          "cost": 0,
                          "distance": 0.33
                      },
                      {
                          "start": "三山街-地铁站",
                          "end": "幕府西路-地铁站",
                          "mode": "metro",
                          "start_time": "12:53",
                          "end_time": "13:11",
                          "price": 4,
                          "cost": 4,
                          "distance": 9.22,
                          "tickets": 1
                      },
                      {
                          "start": "幕府西路-地铁站",
                          "end": "狮子山景区",
                          "mode": "walk",
                          "start_time": "13:11",
                          "end_time": "13:30",
                          "price": 0,
                          "cost": 0,
                          "distance": 1.63
                      }
                  ],
                  "price": 0,
                  "cost": 0,
                  "tickets": 1,
                  "start_time": "13:40",
                  "end_time": "15:00"
              },
              {
                  "position": "秦淮河",
                  "type": "attraction",
                  "transports": [
                      {
                          "start": "狮子山景区",
                          "end": "幕府西路-地铁站",
                          "mode": "walk",
                          "start_time": "15:00",
                          "end_time": "15:19",
                          "price": 0,
                          "cost": 0,
                          "distance": 1.63
                      },
                      {
                          "start": "幕府西路-地铁站",
                          "end": "夫子庙-地铁站",
                          "mode": "metro",
                          "start_time": "15:19",
                          "end_time": "15:37",
                          "price": 4,
                          "cost": 4,
                          "distance": 9.23,
                          "tickets": 1
                      },
                      {
                          "start": "夫子庙-地铁站",
                          "end": "秦淮河",
                          "mode": "walk",
                          "start_time": "15:37",
                          "end_time": "15:46",
                          "price": 0,
                          "cost": 0,
                          "distance": 0.75
                      }
                  ],
                  "price": 0,
                  "cost": 0,
                  "tickets": 1,
                  "start_time": "15:50",
                  "end_time": "17:10"
              },
              {
                  "position": "南京金陵饭店",
                  "type": "accommodation",
                  "transports": [
                      {
                          "start": "秦淮河",
                          "end": "夫子庙-地铁站",
                          "mode": "walk",
                          "start_time": "17:10",
                          "end_time": "17:19",
                          "price": 0,
                          "cost": 0,
                          "distance": 0.75
                      },
                      {
                          "start": "夫子庙-地铁站",
                          "end": "新街口-地铁站",
                          "mode": "metro",
                          "start_time": "17:19",
                          "end_time": "17:23",
                          "price": 2,
                          "cost": 2,
                          "distance": 2.06,
                          "tickets": 1
                      },
                      {
                          "start": "新街口-地铁站",
                          "end": "南京金陵饭店",
                          "mode": "walk",
                          "start_time": "17:23",
                          "end_time": "17:24",
                          "price": 0,
                          "cost": 0,
                          "distance": 0.14
                      }
                  ],
                  "room_type": 2,
                  "price": 680,
                  "cost": 680,
                  "start_time": "17:30",
                  "end_time": "24:00",
                  "rooms": 1
              }
          ]
      },
      {
          "day": 2,
          "activities": [
              {
                  "position": "南京总统府",
                  "type": "attraction",
                  "transports": [
                      {
                          "start": "南京金陵饭店",
                          "end": "新街口-地铁站",
                          "mode": "walk",
                          "start_time": "08:00",
                          "end_time": "08:01",
                          "price": 0,
                          "cost": 0,
                          "distance": 0.14
                      },
                      {
                          "start": "新街口-地铁站",
                          "end": "浮桥-地铁站",
                          "mode": "metro",
                          "start_time": "08:01",
                          "end_time": "08:03",
                          "price": 2,
                          "cost": 2,
                          "distance": 1.36,
                          "tickets": 1
                      },
                      {
                          "start": "浮桥-地铁站",
                          "end": "南京总统府",
                          "mode": "walk",
                          "start_time": "08:03",
                          "end_time": "08:12",
                          "price": 0,
                          "cost": 0,
                          "distance": 0.76
                      }
                  ],
                  "price": 0,
                  "cost": 0,
                  "tickets": 1,
                  "start_time": "08:20",
                  "end_time": "09:40"
              },
              {